id,status,date,area,decision,rationale,adr_path,review_needed
DEC-001,active,2026-07-13,architecture,Use a local application with a thin Chrome connector,Long-running SQLite crawling and model work require a normal local runtime,docs/PRD.md,no
DEC-002,active,2026-07-13,delegation,Route executor-safe slices to Luna max and keep planner-grade gates with the orchestrator,Luna is the user's preferred price-intelligence choice and Terra is excluded,docs/plans/active/foundation-and-first-import.md,no
DEC-003,accepted,2026-07-13,storage,Use Node 26 built-in SQLite for the first persistence path,FTS5 rollback Float32 BLOB backup reopen and cleanup capabilities passed,docs/decisions/0001-sqlite-runtime.md,no
DEC-004,observed,2026-07-13,models,Qwen3.5 9B did not clear the first structured-output gate,HTTP 200 content failed strict JSON parsing and received no semantic retry,docs/decisions/0002-lm-studio-protocol.md,yes
DEC-005,accepted,2026-07-13,catalog-contract,Use recursive discriminated trees as the sole hierarchy and order representation,Parent and index fields duplicated child arrays and allowed contradictory states,docs/architecture/module-map.md,no
DEC-006,accepted,2026-07-13,html-parser,Use parse5 compatible with version 8.0.1 for Chrome bookmark HTML,Node 26 lacks a DOM parser and parse5 provides maintained browser-like parsing with one runtime dependency,docs/decisions/0004-html-parser.md,no
DEC-007,accepted,2026-07-13,chrome-html-contract,Expose one pure importer with fixed typed source failures,Parser implementation needed an ownership boundary before executor delegation,docs/architecture/module-map.md,no
DEC-008,accepted,2026-07-13,catalog-persistence-contract,Return typed Catalog storage failures and keep store plus ID ports Catalog-owned,Missing snapshots must remain distinct from failed loads and SQLite must not own identity or validation policy,docs/architecture/module-map.md,no
DEC-009,accepted,2026-07-13,sqlite-schema,Use normalized immutable snapshot and node tables with partial order indexes,The schema preserves hierarchy and order while keeping SQL mechanics behind Catalog-owned ports,docs/decisions/0005-catalog-sqlite-schema.md,no
DEC-010,active,2026-07-13,processing-sequence,Build durable Jobs before network health processing,Pause resume crash recovery and idempotency should be proven once for every downstream stage,docs/plans/active/durable-processing-and-health.md,no
DEC-011,accepted,2026-07-13,jobs-contract,Use typed batches leases atomic store commands and explicit pause cancel retry transitions,Queue policy must be deterministic testable without SQL and reusable by every processing stage,docs/architecture/module-map.md,no
DEC-012,accepted,2026-07-13,jobs-sqlite-schema,Use normalized batch and job tables with atomic compare-and-set store transactions,Durable lease recovery idempotency and controls require one exact SQL state machine behind Jobs-owned commands,docs/decisions/0007-jobs-sqlite-schema.md,no
DEC-013,accepted,2026-07-13,worker-contract,Use a one-step Jobs worker with typed handler plugins and result-before-success ownership,Bounded steps make stopping deterministic while handler-owned idempotency and untouched interrupted leases make reopen recovery safe,docs/architecture/module-map.md,no
DEC-014,accepted,2026-07-13,health-transport,Use loopback HTTP and raw TCP fixtures as the evidence base for the Health fetch port,Node fetch exposes stable response fields and coarse abort or TypeError names while DNS TLS and socket meaning require typed adapter fixtures,docs/decisions/0008-health-transport-fixtures.md,no
DEC-015,accepted,2026-07-13,health-contract,Store expected network failures as immutable Health observations and assess staleness separately over history,Jobs need durable result references while access/transient evidence must never become an automatic stale or delete decision,docs/architecture/module-map.md,no
DEC-016,accepted,2026-07-13,health-ownership,Expose HealthChecker and StalenessPolicy separately and compose them as HealthService,Observation execution can ship before threshold policy and each consumer depends on one responsibility,docs/architecture/module-map.md,no
DEC-017,accepted,2026-07-13,jobs-recovery,Retain Jobs production and reduce test detail before a real handler exists,The queue has costly verified recovery behavior while its 7127 test lines contain the clearest near-term reduction opportunity,docs/reports/code-reduction-review.md,yes
DEC-018,accepted,2026-07-13,jobs-sql-tests,Retain lease recovery progress and worker reopen SQL proofs,Each candidate protects a distinct transaction rollback projection or durable result boundary,docs/plans/active/durable-processing-and-health.md,no
DEC-019,accepted,2026-07-13,sqlite-spike,Remove the standalone SQLite capability test and retain ADR facts,Current production tests supersede rollback while FTS5 vectors and backup have no runtime consumer,docs/decisions/0001-sqlite-runtime.md,no
DEC-020,accepted,2026-07-13,catalog-sql-tests,Retain all eight Catalog SQLite storage boundaries while compressing test mechanics,The scale proof overlaps round-trip and reopen but not migration freshness missing duplicate scoping rollback corruption or closed-storage behavior,docs/reports/code-reduction-review.md,no
DEC-021,accepted,2026-07-14,first-runnable-import,Place parse-then-import in the Orchestrator and files plus process behavior in a local CLI,This keeps semantic parsing Catalog truth and SQLite lifecycle with their owners while giving the repository one runnable path,docs/architecture/module-map.md,no
DEC-022,accepted,2026-07-14,orchestrator-outcome,Use a local staged outcome union without a flattened Orchestrator code,Shared Outcome requires coded errors but source and Catalog failures retain semantic ownership,docs/architecture/module-map.md,no
DEC-023,accepted,2026-07-14,library-inspection,Project stored snapshots to folder-only output in the Local CLI,Existing Catalog reads provide typed truth while the CLI owns local presentation and process behavior,docs/architecture/module-map.md,no
DEC-024,accepted,2026-07-14,processing-preview,Use versioned health_check_v1 budgets in a Processing module,Selected scope and cost arithmetic need one source shared by CLI preview and later enqueue behavior,docs/architecture/module-map.md,no
DEC-025,accepted,2026-07-14,first-health-handler,Resolve health job bookmark IDs through a narrow Catalog lookup,URLs remain Catalog data and must not enter Jobs targets or inputVersion,docs/architecture/module-map.md,no
DEC-026,accepted,2026-07-14,first-health-handler,Expose a committed-observation Health checker contract before its implementation,The handler needs only an observation ID and closed failure disposition while checker details remain a later contract slice,docs/architecture/module-map.md,no
DEC-027,accepted,2026-07-15,health-persistence,Keep the first Health repository to loadByInput and saveIfAbsent,The deterministic checker needs idempotent durable commit while history listing belongs with the later staleness contract,docs/architecture/module-map.md,no
DEC-028,accepted,2026-07-15,health-execution,Use one request chain with five redirects and no checker retry ports,The executable checker must match the fixed health_check_v1 six-request budget,docs/architecture/module-map.md,no
DEC-029,accepted,2026-07-15,health-node-transport,Map EPROTO to tls_error only on the HTTPS request path,The controlled C9 HTTPS fixture produced this structured code while HTTP EPROTO remains unknown,tests/integration/health-node-transport.test.ts,no
DEC-030,accepted,2026-07-15,health-composition,Keep worker composition in the Local CLI behind opaque SQLite and Node port bundles,This exposes only module contracts and the final one-step worker while raw database resolver transport and handler registry details stay private,docs/architecture/module-map.md,no
DEC-031,accepted,2026-07-15,health-composition,Require callers to supply typed Health queue and retry configuration,The composition root should wire policies without inventing production operating values,apps/local-cli/health-worker-session.ts,no
DEC-032,accepted,2026-07-15,processing-enqueue,Let Processing author selected-scope Jobs requests while Jobs performs enqueue,This keeps traversal profile expansion ordering and run identity with one owner while durable scheduling stays in Jobs,docs/architecture/module-map.md,no
DEC-033,accepted,2026-07-15,processing-enqueue,Add an enqueue-only Jobs facade with caller-authored Processing run IDs,The CLI can enqueue idempotently without fake worker policy values and a new run ID explicitly requests fresh Health inputs,docs/architecture/module-map.md,no
DEC-034,accepted,2026-07-15,health-node-transport,Apply each transport timeout to target resolution plus socket exchange,A live one-job command needs a complete per-hop deadline and late DNS results must not start requests,docs/architecture/module-map.md,no
DEC-035,accepted,2026-07-15,local-one-job-worker,Use one fixed health_check_v1 operating profile for worker:once,Explicit first-run values avoid runtime flags and cannot silently become a multi-attempt retry policy,docs/architecture/module-map.md,no
DEC-036,accepted,2026-07-15,local-one-job-worker,Treat idle succeeded and failure-reported steps as successful redacted command outcomes,Each is a completed durable worker step while lease targets tokens timestamps URLs input versions and diagnostics stay private,docs/architecture/module-map.md,no
DEC-037,accepted,2026-07-15,architecture-audit,Keep current module ownership and repair inspection through an additive Catalog query contract,Current runtime imports respect public seams while the CLI projection is the isolated ownership violation and does not justify a redesign,docs/architecture/module-map.md,yes
DEC-038,accepted,2026-07-16,repository-verification,Use recursive sorted test discovery and a TypeScript-AST contract as the standard repository gate,New tests and static cross-module imports now enroll automatically without another dependency or maintained manifest,package.json,no
DEC-039,accepted,2026-07-16,catalog-inspection,Place folder-only inspection projection and descendant counts behind an additive Catalog query contract,Catalog owns snapshot hierarchy meaning while the Local CLI owns only process formatting and lifecycle,docs/architecture/module-map.md,no
DEC-040,accepted,2026-07-16,bounded-bookmark-trees,Check depth before node count when one node violates both limits and back public runtime constants with private owner-local values,This makes failure precedence deterministic and lets same-module implementations consume the exact policy without importing their own public entry point,docs/architecture/module-map.md,no
DEC-041,accepted,2026-07-16,chrome-html-source,Represent malformed file bytes as invalid_encoding and decode UTF8 fatally before storage,Permissive decoding changes source data while the existing source failure boundary can reject it without a new CLI result shape,docs/architecture/module-map.md,no
DEC-042,accepted,2026-07-16,health-request-safety,Apply IANA IPv4 special-purpose prefixes with explicit global exceptions through one shared disposition,Direct IPv4 mapped IPv6 and RFC6052 targets must receive identical fail-closed eligibility decisions,docs/architecture/module-map.md,no
