id,wave,status,owner,branch,worktree,scope,description,next_action,created_at,updated_at
W-001,foundation,done,orchestrator,main,/Users/mike/Developer/repos/bookmark-clean,slice-1,Bootstrap TypeScript verification shell,Polish and execute Slice 2 SQLite capability probe,2026-07-13,2026-07-13
W-002,foundation,done,orchestrator,main,/Users/mike/Developer/repos/bookmark-clean,slice-2,Prove built-in SQLite capabilities,Polish and execute Slice 3 LM Studio protocol probe,2026-07-13,2026-07-13
W-003,foundation,done,orchestrator,main,/Users/mike/Developer/repos/bookmark-clean,slice-3,Probe live LM Studio protocol,Audit first batch and refresh the active queue,2026-07-13,2026-07-13
W-004,foundation,done,orchestrator,main,/Users/mike/Developer/repos/bookmark-clean,slice-4,Characterize Chrome HTML import inputs,Polish and execute Slice 5 shared value contracts,2026-07-13,2026-07-13
W-005,foundation,done,orchestrator,main,/Users/mike/Developer/repos/bookmark-clean,slice-5,Implement shared value contracts,Run Slice 6 catalog architecture contract gate,2026-07-13,2026-07-13
W-006,foundation,done,orchestrator,main,/Users/mike/Developer/repos/bookmark-clean,slice-6,Complete catalog import contract,Audit Slices 4-6 and refresh contract-dependent queue,2026-07-13,2026-07-13
W-007,foundation,done,orchestrator,main,/Users/mike/Developer/repos/bookmark-clean,slice-7,Implement catalog types and strict input validation,Run Slice 8 HTML parser dependency gate,2026-07-13,2026-07-13
W-008,foundation,done,orchestrator,main,/Users/mike/Developer/repos/bookmark-clean,slice-8,Select Chrome HTML parser dependency,Define Chrome HTML adapter public contract,2026-07-13,2026-07-13
W-009,foundation,done,orchestrator,main,/Users/mike/Developer/repos/bookmark-clean,slice-9,Define Chrome HTML adapter public contract,Refresh and polish the Chrome HTML parser implementation slice,2026-07-13,2026-07-13
W-010,foundation,done,orchestrator,main,/Users/mike/Developer/repos/bookmark-clean,slice-10,Parse Chrome HTML into Catalog input,Refresh persistence queue around typed storage failures and missing Catalog service,2026-07-13,2026-07-13
W-011,foundation,done,orchestrator,main,/Users/mike/Developer/repos/bookmark-clean,slice-11,Resolve Catalog persistence failures and ports,Implement exact executable Catalog contract types,2026-07-13,2026-07-13
W-012,foundation,done,orchestrator,main,/Users/mike/Developer/repos/bookmark-clean,slice-12,Implement executable Catalog persistence contracts,Polish and delegate Catalog service implementation,2026-07-13,2026-07-13
W-013,foundation,done,orchestrator,main,/Users/mike/Developer/repos/bookmark-clean,slice-13,Implement Catalog import service,Audit Slices 11 through 13 and refresh SQLite packet,2026-07-13,2026-07-13
W-014,foundation,done,orchestrator,main,/Users/mike/Developer/repos/bookmark-clean,slice-14,Implement Catalog crypto ID factory,Polish SQLite snapshot-store implementation packet,2026-07-13,2026-07-13
W-015,foundation,done,orchestrator,main,/Users/mike/Developer/repos/bookmark-clean,slice-15,Define SQLite Catalog schema and failure mapping,Delegate exact migration and store packet to Luna max,2026-07-13,2026-07-13
W-016,foundation,done,orchestrator,main,/Users/mike/Developer/repos/bookmark-clean,slice-16,Implement SQLite Catalog snapshot store,Polish and run 10000-node end-to-end benchmark,2026-07-13,2026-07-13
W-017,foundation,done,orchestrator,main,/Users/mike/Developer/repos/bookmark-clean,slice-17,Prove 10000-node end-to-end import integrity and cost,Audit and close foundation horizon then plan durable processing,2026-07-13,2026-07-13
W-018,processing,done,orchestrator,main,/Users/mike/Developer/repos/bookmark-clean,slice-18,Complete durable Jobs architecture contract,Implement shared Jobs identifiers as isolated public contract,2026-07-13,2026-07-13
W-019,processing,done,orchestrator,main,/Users/mike/Developer/repos/bookmark-clean,slice-19,Implement shared Jobs identifiers,Implement exact executable Jobs public types,2026-07-13,2026-07-13
W-020,processing,done,orchestrator,main,/Users/mike/Developer/repos/bookmark-clean,slice-20,Implement executable Jobs public types,Audit contract batch and delegate Jobs service against fake store,2026-07-13,2026-07-13
W-021,processing,done,orchestrator,main,/Users/mike/Developer/repos/bookmark-clean,slice-21,Implement Jobs service against fake store,Define SQLite Jobs schema and atomic algorithms,2026-07-13,2026-07-13
W-022,processing,done,orchestrator,main,/Users/mike/Developer/repos/bookmark-clean,slice-22,Define SQLite Jobs schema and atomic algorithms,Implement migration and idempotent enqueue as first adapter slice,2026-07-13,2026-07-13
W-023,processing,done,orchestrator,main,/Users/mike/Developer/repos/bookmark-clean,slice-23,Implement Jobs migration and idempotent enqueue,Implement atomic expired-lease recovery and deterministic leasing,2026-07-13,2026-07-13
W-024,processing,done,orchestrator,main,/Users/mike/Developer/repos/bookmark-clean,slice-24,Implement expired-lease recovery and leasing,Audit Jobs SQL batch and implement transitions plus controls,2026-07-13,2026-07-13
W-025,processing,done,orchestrator,main,/Users/mike/Developer/repos/bookmark-clean,slice-25,Implement lease transitions and batch controls,Implement progress recovery and the SQLite Jobs store facade,2026-07-13,2026-07-13
W-026,processing,done,orchestrator,main,/Users/mike/Developer/repos/bookmark-clean,slice-26,Implement progress and Jobs store facade,Audit completed Jobs SQL batch and define the worker execution contract,2026-07-13,2026-07-13
W-027,processing,done,orchestrator,main,/Users/mike/Developer/repos/bookmark-clean,slice-27,Define worker execution and durable-result contract,Implement the isolated executable worker type migration,2026-07-13,2026-07-13
W-028,processing,done,orchestrator,main,/Users/mike/Developer/repos/bookmark-clean,slice-28,Implement executable worker and handler types,Implement the one-step worker service against fakes,2026-07-13,2026-07-13
W-029,processing,done,orchestrator,main,/Users/mike/Developer/repos/bookmark-clean,slice-29,Implement one-step worker service,Prove durable result idempotency and resume after database reopen,2026-07-13,2026-07-13
W-030,processing,done,orchestrator,main,/Users/mike/Developer/repos/bookmark-clean,slice-30,Prove interruption and resume after reopen,Audit worker batch and characterize deterministic Health transport inputs,2026-07-13,2026-07-13
W-031,processing,done,orchestrator,main,/Users/mike/Developer/repos/bookmark-clean,slice-31,Characterize deterministic Health inputs,Define the Health observation fetch repository and staleness contracts,2026-07-13,2026-07-13
W-032,processing,done,orchestrator,main,/Users/mike/Developer/repos/bookmark-clean,slice-32,Complete Health architecture contract,Implement the isolated executable Health type surface,2026-07-13,2026-07-13
W-033,processing,done,orchestrator,main,/Users/mike/Developer/repos/bookmark-clean,slice-33,Implement executable Health contract types,Implement pure Health fact classification before service orchestration,2026-07-13,2026-07-13
W-034,processing,done,orchestrator,main,/Users/mike/Developer/repos/bookmark-clean,slice-34,Implement pure Health fact classification,Implement idempotent Health service orchestration against fake ports,2026-07-13,2026-07-13
W-035,processing,done,orchestrator,main,/Users/mike/Developer/repos/bookmark-clean,slice-35,Separate Health checking from staleness policy ownership,Implement the isolated executable interface split before checker runtime code,2026-07-13,2026-07-13
W-036,processing,done,orchestrator,main,/Users/mike/Developer/repos/bookmark-clean,slice-36,Implement Health checker and staleness interface split,Implement idempotent Health checker orchestration against fake ports,2026-07-13,2026-07-13
W-037,processing,cancelled,orchestrator,main,/Users/mike/Developer/repos/bookmark-clean,slice-37,Implement bounded Health check execution against fakes,Superseded by the user-approved recovery review and reduction plan,2026-07-13,2026-07-13
W-038,recovery,done,orchestrator,main,/Users/mike/Developer/repos/bookmark-clean,slice-r1,Build the code-reduction manifest,Execute R2 removal of the standalone LM Studio spike,2026-07-13,2026-07-13
W-039,recovery,done,orchestrator,main,/Users/mike/Developer/repos/bookmark-clean,slice-r2,Remove the standalone LM Studio spike,Execute R3 removal of Health implementation and unit tests,2026-07-13,2026-07-13
W-040,recovery,done,orchestrator,main,/Users/mike/Developer/repos/bookmark-clean,slice-r3,Remove Health implementation and unit tests,Execute R4 removal of Health transport test machinery,2026-07-13,2026-07-13
W-041,recovery,done,orchestrator,main,/Users/mike/Developer/repos/bookmark-clean,slice-r4,Remove Health transport test machinery,Execute R5A architecture gate for Health contract removal,2026-07-13,2026-07-13
W-042,recovery,done,orchestrator,main,/Users/mike/Developer/repos/bookmark-clean,slice-r5a,Gate executable Health contract removal,Execute R5B isolated removal of executable Health types and contract tests,2026-07-13,2026-07-13
W-043,recovery,done,orchestrator,main,/Users/mike/Developer/repos/bookmark-clean,slice-r5b,Remove executable Health contract,Review the Jobs resume core before any high-blast-radius deletion,2026-07-13,2026-07-13
W-044,recovery,done,orchestrator,main,/Users/mike/Developer/repos/bookmark-clean,slice-r6,Decide the Jobs resume core,Execute R7A compression of the Jobs typecheck matrix,2026-07-13,2026-07-13
W-045,recovery,done,orchestrator,main,/Users/mike/Developer/repos/bookmark-clean,slice-r7a,Compress the Jobs typecheck matrix,Execute R7B compression of worker happy-path tests,2026-07-13,2026-07-13
W-046,recovery,done,orchestrator,main,/Users/mike/Developer/repos/bookmark-clean,slice-r7b,Compress worker happy-path tests,Execute R7C compression of queue transition orchestration tests,2026-07-13,2026-07-13
W-047,recovery,done,orchestrator,main,/Users/mike/Developer/repos/bookmark-clean,slice-r7c,Compress queue transition orchestration tests,Execute R7D SQL overlap review before any further Jobs deletion,2026-07-13,2026-07-13
W-048,recovery,done,orchestrator,main,/Users/mike/Developer/repos/bookmark-clean,slice-r7d,Review Jobs SQL overlap,Audit Catalog import overlap and the SQLite capability spike,2026-07-13,2026-07-13
W-049,recovery,done,orchestrator,main,/Users/mike/Developer/repos/bookmark-clean,slice-r8a,Audit Catalog import overlap and the SQLite capability spike,Execute R8B removal of the standalone SQLite capability spike,2026-07-13,2026-07-13
W-050,recovery,done,orchestrator,main,/Users/mike/Developer/repos/bookmark-clean,slice-r8b,Remove the standalone SQLite capability spike,Execute R8C compression of the Catalog type matrix,2026-07-13,2026-07-13
W-051,recovery,done,orchestrator,main,/Users/mike/Developer/repos/bookmark-clean,slice-r8c,Compress the Catalog type matrix,Execute R8D compression of the Catalog validator contract suite,2026-07-13,2026-07-13
W-052,recovery,done,orchestrator,main,/Users/mike/Developer/repos/bookmark-clean,slice-r8d,Compress the Catalog validator contract suite,Polish and execute R8E compression of Chrome HTML parser coverage,2026-07-13,2026-07-13
W-053,recovery,done,orchestrator,main,/Users/mike/Developer/repos/bookmark-clean,slice-r8e,Compress Chrome HTML parser coverage,Polish and execute R8F compression of Catalog service coverage,2026-07-13,2026-07-13
W-054,recovery,done,orchestrator,main,/Users/mike/Developer/repos/bookmark-clean,slice-r8f,Compress Catalog service coverage,Execute R8G review of Catalog SQLite detail against the vertical proof,2026-07-13,2026-07-13
W-055,recovery,done,orchestrator,main,/Users/mike/Developer/repos/bookmark-clean,slice-r8g,Review Catalog SQLite detail against the vertical proof,Polish and execute R8H bounded compression without dropping a storage boundary,2026-07-13,2026-07-13
W-056,recovery,done,orchestrator,main,/Users/mike/Developer/repos/bookmark-clean,slice-r8h,Compress Catalog SQLite test mechanics,Recovery queue complete; plan the first runnable product path separately,2026-07-13,2026-07-13
W-057,runnable-import,done,orchestrator,main,/Users/mike/Developer/repos/bookmark-clean,architecture-and-plan,Define the first runnable import architecture and rolling plan,Polish and execute S1 Catalog runtime factories,2026-07-14,2026-07-14
W-058,runnable-import,done,orchestrator,main,/Users/mike/Developer/repos/bookmark-clean,slice-s1,Expose Catalog runtime factories,Execute S2 Chrome HTML runtime parser,2026-07-14,2026-07-14
W-059,runnable-import,done,orchestrator,main,/Users/mike/Developer/repos/bookmark-clean,slice-s2,Expose Chrome HTML runtime parser,Refresh the queue and execute S3 Catalog SQLite session,2026-07-14,2026-07-14
W-060,runnable-import,done,orchestrator,main,/Users/mike/Developer/repos/bookmark-clean,slice-s3,Add the Catalog SQLite session,Refresh the queue and execute S4 parse-then-import orchestration,2026-07-14,2026-07-14
W-061,runnable-import,done,orchestrator,main,/Users/mike/Developer/repos/bookmark-clean,slice-s4,Add parse-then-import orchestration,Execute S5 local import command in a new implementation batch,2026-07-14,2026-07-14
W-062,runnable-import,done,orchestrator,main,/Users/mike/Developer/repos/bookmark-clean,slice-s5-delivery,Ship the local import command,Plan representative real-export acceptance only when sanitized evidence exists,2026-07-14,2026-07-14
W-063,runnable-import,done,orchestrator,main,/Users/mike/Developer/repos/bookmark-clean,slice-s6-live-acceptance,Protect and verify one private real Chrome export,Re-run only when a different export shape or Chrome version supplies new evidence,2026-07-14,2026-07-14
W-064,library-inspection,done,orchestrator,main,/Users/mike/Developer/repos/bookmark-clean,slice-i1,Add the read-only inspect command,Plan selected-folder processing preview as a separate workstream,2026-07-14,2026-07-14
W-065,selected-folder-processing,done,orchestrator,main,/Users/mike/Developer/repos/bookmark-clean,architecture-and-plan,Define preview ownership budgets and handler prerequisites,Execute P1 Processing planner,2026-07-14,2026-07-14
W-066,selected-folder-processing,done,orchestrator,main,/Users/mike/Developer/repos/bookmark-clean,slice-p1,Add the Processing planner,Execute P2 preview CLI,2026-07-14,2026-07-14
W-067,selected-folder-processing,done,orchestrator,main,/Users/mike/Developer/repos/bookmark-clean,slice-p2,Ship the preview CLI,Execute H1 Catalog bookmark lookup from the first Health handler plan,2026-07-14,2026-07-14
W-068,first-health-handler,done,orchestrator,main,/Users/mike/Developer/repos/bookmark-clean,slices-h1-h3,Add Catalog lookup Health contract and first handler,Plan bounded checker and durable Health repository as separate slices,2026-07-14,2026-07-14
W-069,health-runtime,done,orchestrator,main,/Users/mike/Developer/repos/bookmark-clean,slice-c1,Add immutable Health observation and repository contracts,Execute C2 Health schema and validated reader,2026-07-15,2026-07-15
W-070,health-runtime,done,orchestrator,main,/Users/mike/Developer/repos/bookmark-clean,slice-c2,Add Health schema and validated SQLite reader,Execute C3 atomic observation writer,2026-07-15,2026-07-15
W-071,health-runtime,done,orchestrator,main,/Users/mike/Developer/repos/bookmark-clean,slice-c3,Add atomic SQLite Health observation writer,Execute C4 bounded checker execution contracts,2026-07-15,2026-07-15
W-072,health-runtime,done,orchestrator,main,/Users/mike/Developer/repos/bookmark-clean,slice-c4,Add bounded Health checker execution contracts,Execute C5 typed fact classifier,2026-07-15,2026-07-15
W-073,health-runtime,done,orchestrator,main,/Users/mike/Developer/repos/bookmark-clean,slice-c5,Add pure typed Health fact classifier,Execute C6 deterministic checker service,2026-07-15,2026-07-15
W-074,health-runtime,done,orchestrator,main,/Users/mike/Developer/repos/bookmark-clean,slice-c6,Add deterministic idempotent Health checker,Execute C7 controlled Node transport evidence,2026-07-15,2026-07-15
W-075,health-runtime,done,orchestrator,main,/Users/mike/Developer/repos/bookmark-clean,slice-c7,Record controlled structured Node transport evidence,Execute C8 safe request-target resolver,2026-07-15,2026-07-15
W-076,health-runtime,done,orchestrator,main,/Users/mike/Developer/repos/bookmark-clean,slice-c8,Add safe pinned Health request-target resolver,Execute C9 safe Node transport adapter,2026-07-15,2026-07-15
W-077,health-runtime,done,orchestrator,main,/Users/mike/Developer/repos/bookmark-clean,slice-c9,Add safe pinned one-request Node Health transport,Plan public composition through a new architecture gate,2026-07-15,2026-07-15
W-078,health-composition,done,orchestrator,main,/Users/mike/Developer/repos/bookmark-clean,composition-planning,Define public composition boundaries and prepare C10,Execute C10 multi-module SQLite session,2026-07-15,2026-07-15
W-079,health-composition,done,orchestrator,main,/Users/mike/Developer/repos/bookmark-clean,slice-c10,Add an opaque multi-module SQLite session,Execute C11 public Node runtime ports,2026-07-15,2026-07-15
W-080,health-composition,done,orchestrator,main,/Users/mike/Developer/repos/bookmark-clean,slice-c11,Expose safe Node runtime ports,Execute C12 controlled HTTPS success evidence,2026-07-15,2026-07-15
W-081,health-composition,done,orchestrator,main,/Users/mike/Developer/repos/bookmark-clean,slice-c12,Prove controlled certificate-validated HTTPS success,Execute C13 public Jobs composition factories,2026-07-15,2026-07-15
W-082,health-composition,done,orchestrator,main,/Users/mike/Developer/repos/bookmark-clean,slice-c13,Promote existing Jobs composition factories,Execute C14 Local Health worker session,2026-07-15,2026-07-15
W-083,health-composition,done,orchestrator,main,/Users/mike/Developer/repos/bookmark-clean,slice-c14,Compose the Local Health worker session,Re-plan selected-folder enqueue before further implementation,2026-07-15,2026-07-15
W-084,processing-enqueue,done,orchestrator,main,/Users/mike/Developer/repos/bookmark-clean,architecture-planning,Place selected-folder durable enqueue and define its contracts,Run rolling slice planning from the capability brief,2026-07-15,2026-07-15
W-085,processing-enqueue,done,orchestrator,main,/Users/mike/Developer/repos/bookmark-clean,slice-e1,Add the narrow Jobs enqueue-only composition seam,Polish and execute E2 Processing durable-start types,2026-07-15,2026-07-15
W-086,processing-enqueue,done,orchestrator,main,/Users/mike/Developer/repos/bookmark-clean,slice-e2,Add the type-only Processing durable-start contract,Polish and execute E3 Processing starter implementation,2026-07-15,2026-07-15
W-087,processing-enqueue,done,orchestrator,main,/Users/mike/Developer/repos/bookmark-clean,slice-e3,Implement deterministic Processing start authorship and its public factory,Execute E4 real SQLite enqueue and replay proof,2026-07-15,2026-07-15
W-088,processing-enqueue,done,orchestrator,main,/Users/mike/Developer/repos/bookmark-clean,slice-e4,Prove selected-folder enqueue and replay through real SQLite public seams,Polish and execute E5 Local enqueue command function,2026-07-15,2026-07-15
W-089,processing-enqueue,done,orchestrator,main,/Users/mike/Developer/repos/bookmark-clean,slice-e5,Add the direct Local enqueue command contract and composition,Execute E6 package routing and subprocess acceptance,2026-07-15,2026-07-15
W-090,processing-enqueue,done,orchestrator,main,/Users/mike/Developer/repos/bookmark-clean,slice-e6,Expose enqueue through the package CLI and prove subprocess replay,Select the next independent workstream,2026-07-15,2026-07-15
W-091,one-job-worker,done,orchestrator,main,/Users/mike/Developer/repos/bookmark-clean,architecture-planning,Define the bounded one-job worker command and operating profile,Polish and execute F1 complete Node transport deadline,2026-07-15,2026-07-15
W-092,one-job-worker,done,orchestrator,main,/Users/mike/Developer/repos/bookmark-clean,slice-f1,Bound the complete Node Health transport call,Polish and execute F2 type-only run-one command contract,2026-07-15,2026-07-15
W-093,one-job-worker,done,orchestrator,main,/Users/mike/Developer/repos/bookmark-clean,slice-f2,Add the type-only run-one command contract,Refresh and polish F3 direct run-one command,2026-07-15,2026-07-15
W-094,one-job-worker,done,orchestrator,main,/Users/mike/Developer/repos/bookmark-clean,slice-f3,Implement the direct run-one command,Refresh and polish F4 real SQLite queued-job proof,2026-07-15,2026-07-15
W-095,one-job-worker,done,orchestrator,main,/Users/mike/Developer/repos/bookmark-clean,slice-f4,Prove one queued job through real SQLite,Refresh and polish F5 package routing and subprocess acceptance,2026-07-15,2026-07-15
W-096,one-job-worker,done,orchestrator,main,/Users/mike/Developer/repos/bookmark-clean,slice-f5,Add package routing and subprocess acceptance,Await an explicit commit request or select the next independent workstream,2026-07-15,2026-07-15
W-097,adversarial-audit,done,orchestrator,main,/Users/mike/Developer/repos/bookmark-clean,audit-and-remediation-plan,Review architecture correctness security verification and project memory then write a ranked report and executable rolling plan,Execute Slice 1 with the single-slice executor after user approval,2026-07-15,2026-07-15
W-098,adversarial-remediation,done,orchestrator,main,/Users/mike/Developer/repos/bookmark-clean,slice-1-absolute-health-deadline,Enforce one absolute Health transport deadline across resolution and the complete socket exchange,Await explicit approval at the economic gate before executing Slice 2,2026-07-16,2026-07-16
W-099,adversarial-remediation,done,orchestrator,main,/Users/mike/Developer/repos/bookmark-clean,slice-2-ipv6-request-target-policy,Reject unsafe and non-global special-purpose IPv6 request targets using a dated explicit registry policy,Polish and execute Slice 3 owner-only SQLite file creation and tightening,2026-07-16,2026-07-16
W-100,adversarial-remediation,done,orchestrator,main,/Users/mike/Developer/repos/bookmark-clean,slice-3-owner-only-sqlite-files,Create and tighten file-backed Bookmark Clean SQLite databases as owner-only before use,Refresh and audit the rolling queue then polish Slice 4 production type repairs,2026-07-16,2026-07-16
W-101,adversarial-remediation,done,orchestrator,main,/Users/mike/Developer/repos/bookmark-clean,checkpoint-1-audit-and-refresh,Audit completed Slices 1 through 3 and refresh the remaining queue against current compiler and test evidence,Polish and execute Slice 4 non-Jobs production type repairs,2026-07-16,2026-07-16
W-102,adversarial-remediation,done,orchestrator,main,/Users/mike/Developer/repos/bookmark-clean,slice-4-non-jobs-type-errors,Repair five strict production type errors across Node Health and shared SQLite boundaries without runtime behavior changes,Polish and execute Slice 5 Jobs production type repairs against the isolated 25-error baseline,2026-07-16,2026-07-16
W-103,adversarial-remediation,done,orchestrator,main,/Users/mike/Developer/repos/bookmark-clean,slice-5-jobs-type-errors,Repair the remaining 25 strict production errors across Jobs domain and SQLite receiving boundaries without state-machine changes,Polish and execute Slice 6 complete self-enrolling verification gates on the zero-error source baseline,2026-07-16,2026-07-16
W-104,adversarial-remediation,done,orchestrator,main,/Users/mike/Developer/repos/bookmark-clean,slice-6-complete-verification-gates,Make typecheck tests and module-boundary enforcement complete deterministic and self-enrolling,Audit Slices 4 through 6 and refresh the remaining queue before Slice 7,2026-07-16,2026-07-16
W-105,adversarial-remediation,done,orchestrator,main,/Users/mike/Developer/repos/bookmark-clean,checkpoint-2-audit-and-refresh,Audit completed Slices 4 through 6 and refresh the remaining queue against the complete aggregate gate,Polish and execute Slice 7 structured DNS and TLS classification,2026-07-16,2026-07-16
W-106,adversarial-remediation,done,orchestrator,main,/Users/mike/Developer/repos/bookmark-clean,slice-7-dns-tls-classification,Restore existing DNS and TLS Health facts from explicit structured Node error codes,Polish and execute Slice 8 full Health repository outcome validation,2026-07-16,2026-07-16
W-107,adversarial-remediation,done,orchestrator,main,/Users/mike/Developer/repos/bookmark-clean,slice-8-health-repository-validation,Fully validate every Health observation returned by repository load and save boundaries,Use the architecture contract then implement Slice 9 additive Catalog inspection types only,2026-07-16,2026-07-16
W-108,adversarial-remediation,done,orchestrator,main,/Users/mike/Developer/repos/bookmark-clean,slice-9-catalog-inspection-contract,Define the additive Catalog-owned folder inspection query before any producer or consumer migration,Audit Slices 7 through 9 then execute Slice 10 against the fixed contract,2026-07-16,2026-07-16
W-109,adversarial-remediation,done,orchestrator,main,/Users/mike/Developer/repos/bookmark-clean,checkpoint-3-audit-and-refresh,Audit Slices 7 through 9 and refresh the final implementation packet against current contracts and gates,Polish and execute Slice 10 Catalog inspector implementation and CLI migration,2026-07-16,2026-07-16
W-110,adversarial-remediation,done,orchestrator,main,/Users/mike/Developer/repos/bookmark-clean,slice-10-catalog-inspector-cli,Implement the fixed Catalog inspection projection and migrate CLI formatting without output changes,Run the final ten-slice completed-work audit and repository verification review,2026-07-16,2026-07-16
W-111,adversarial-remediation,done,orchestrator,main,/Users/mike/Developer/repos/bookmark-clean,final-ten-slice-audit,Audit all remediation packets diffs gates ledgers and remaining declared backlog before completion,Ready for user review with all ten slices complete and deep-input plus project-memory work explicitly retained in the rough backlog,2026-07-16,2026-07-16
