id,wave,status,owner,branch,worktree,scope,description,next_action,created_at,updated_at
W-112,adversarial-remediation-corrections,done,orchestrator,main,/Users/mike/Developer/repos/bookmark-clean,slice-11-ipv6-global-eligibility,Fail closed on reserved deprecated-local and phased-out IPv6 request targets while preserving safe embedded-public IPv4 encodings,Polish and execute Slice 12 Health save-boundary requested-URL identity,2026-07-16,2026-07-16
W-113,adversarial-remediation-corrections,done,orchestrator,main,/Users/mike/Developer/repos/bookmark-clean,slice-12-health-save-url-identity,Reject structurally valid Health save results whose requested URL conflicts with the initiating request,No corrective slices remain; select a rough-backlog workstream through a new planning run,2026-07-16,2026-07-16
W-114,adversarial-remediation-followups,done,orchestrator,main,/Users/mike/Developer/repos/bookmark-clean,slice-13-project-memory,Reconcile completed plans repaired risks and superseded transport evidence,Execute Slice 14 import-equals boundary-gate coverage,2026-07-16,2026-07-16
W-115,adversarial-remediation-followups,done,orchestrator,main,/Users/mike/Developer/repos/bookmark-clean,slice-14-import-equals-gate,Detect TypeScript import-equals references in the public-module boundary gate,Execute Slice 15 bounded bookmark-tree public contracts,2026-07-16,2026-07-16
W-116,adversarial-remediation-followups,done,orchestrator,main,/Users/mike/Developer/repos/bookmark-clean,slice-15-bounded-tree-contracts,Publish exact Catalog and Chrome HTML resource-limit contracts,Refresh the queue then execute Slice 16 iterative Catalog enforcement,2026-07-16,2026-07-16
W-117,adversarial-remediation-followups,done,orchestrator,main,/Users/mike/Developer/repos/bookmark-clean,checkpoint-4-audit-and-refresh,Audit Slices 13 through 15 and refresh the bounded-tree queue against current runtime dependency shape,Execute Slice 16 iterative Catalog enforcement,2026-07-16,2026-07-16
W-118,adversarial-remediation-followups,done,orchestrator,main,/Users/mike/Developer/repos/bookmark-clean,slice-16-iterative-catalog-limits,Enforce Catalog node and depth limits with iterative validation and construction,Execute Slice 17 bounded Chrome HTML and CLI input,2026-07-16,2026-07-16
W-119,adversarial-remediation-followups,done,orchestrator,main,/Users/mike/Developer/repos/bookmark-clean,slice-17-bounded-chrome-html,Bound Local CLI file reads and make Chrome HTML translation iterative under public byte node and depth limits,Execute Slice 18 iterative bounded SQLite persistence,2026-07-16,2026-07-16
W-120,adversarial-remediation-followups,done,orchestrator,main,/Users/mike/Developer/repos/bookmark-clean,slice-18-bounded-sqlite-persistence,Make Catalog snapshot save and reconstruction iterative and reject over-budget stored graphs,Audit Slices 16 through 18 and execute Slice 19,2026-07-16,2026-07-16
W-121,adversarial-remediation-followups,done,orchestrator,main,/Users/mike/Developer/repos/bookmark-clean,checkpoint-5-audit-and-refresh,Audit Slices 16 through 18 and refresh the final two packets against current bounded implementations,Execute Slice 19 stack-safe inspection and formatting,2026-07-16,2026-07-16
W-122,adversarial-remediation-followups,done,orchestrator,main,/Users/mike/Developer/repos/bookmark-clean,slice-19-stack-safe-inspection,Make Catalog inspection projection and Local CLI formatting iterative with resource validation,Execute Slice 20 bounded Processing and final risk closure,2026-07-16,2026-07-16
W-123,adversarial-remediation-followups,done,orchestrator,main,/Users/mike/Developer/repos/bookmark-clean,slice-20-bounded-processing,Make Processing selection iterative validate Catalog bounds and close RISK-014 after final verification,Run final completed-plan audit and archive the plan,2026-07-16,2026-07-16
W-124,adversarial-remediation-followups,done,orchestrator,main,/Users/mike/Developer/repos/bookmark-clean,final-followup-audit,Audit Slices 13 through 20 run final deep probes validate artifacts close RISK-014 and archive the completed plan,Ready for user review with no remediation slice remaining,2026-07-16,2026-07-16
W-125,adversarial-review-corrections,done,orchestrator,main,/Users/mike/Developer/repos/bookmark-clean,slice-1-health-fact-coherence,Reject structurally valid but contradictory Health repository observations,Execute the malformed UTF8 failure contract,2026-07-16,2026-07-16
W-126,adversarial-review-corrections,done,orchestrator,main,/Users/mike/Developer/repos/bookmark-clean,slice-2-invalid-encoding-contract,Add the Chrome HTML invalid_encoding source failure contract,Implement fatal UTF8 decoding in the Local CLI,2026-07-16,2026-07-16
W-127,adversarial-review-corrections,done,orchestrator,main,/Users/mike/Developer/repos/bookmark-clean,slice-3-fatal-utf8-decoding,Reject malformed Chrome HTML bytes before opening storage,Align IPv4 target policy with the IANA registry,2026-07-16,2026-07-16
W-128,adversarial-review-corrections,done,orchestrator,main,/Users/mike/Developer/repos/bookmark-clean,slice-4-iana-ipv4-policy,Reject non-global IPv4 targets and preserve declared global exceptions,Archive the completed correction plan after aggregate verification,2026-07-16,2026-07-16
